id,category,citation,design,population,result,limitation,relevance,doi,pmid,status
simner2010,established component,"Simner; Cuskley; Kirby (2010), Perception 39(4):553-569",cross-sectional matching experiment,"65 participants; adolescent/adult indexing in PubMed","Systematic shared mappings between acoustic continua and basic tastes/concentrations","Preference matching is not induced taste perception",Supports spontaneous crossmodal mapping,10.1068/p6591,20515002,peer reviewed
crisinel2010,established component,"Crisinel; Spence (2010), Attention Perception & Psychophysics 72(7):1994-2002",explicit sound-taste/flavor matching,"adult nonsynesthetes; exact N not stated in PubMed abstract","Sweet/sour preferentially matched with high pitch; umami/bitter with low pitch","Explicit matching and familiarity/hedonics may drive results",Supports auditory-gustatory correspondence not transfer,10.3758/APP.72.7.1994,20952795,peer reviewed
carvalho2017,established component,"Reinoso Carvalho; Wang; van Ee; Persoone; Spence (2017), Appetite 108:383-390",randomized repeated tasting of identical chocolate,"participants tasted identical chocolate twice; exact N not stated in PubMed abstract","Creamy soundtrack increased rated creaminess and sweetness versus rough soundtrack","Food remained present; no evidence sound generated taste alone",Supports multisensory modification during tasting,10.1016/j.appet.2016.10.026,27784634,peer reviewed
janata2009,plausible mechanism,"Janata (2009), Cerebral Cortex 19(11):2579-2594",fMRI music-evoked autobiographical memory study,"healthy participants; verify full text before quoting N","Music-evoked autobiographical memory tracked with medial prefrontal activity","Familiar music differs from novel procedural signatures; fMRI inference does not transfer to UMBRAL",Supports music-memory link not learned novel cue,10.1093/cercor/bhp008,19240137,peer reviewed
kershaw2018,established component,"Kershaw; Running (2018), Archives of Oral Biology 92:90-95",classical conditioning with visual cue predicting sour candy,"human participants; exact N not stated in accessible abstract","Greater saliva weight for candy-paired image and increase across first visit","Salivation is not taste; visual cue and candy do not establish auditory transfer",Supports conditioned anticipatory physiology,10.1016/j.archoralbio.2018.05.010,29778624,peer reviewed
avery2023,plausible mechanism,"Avery; Carrington; Martin (2023), Progress in Neurobiology 223:102423",high-field fMRI with imagined tastes and food pictures,"human participants; exact N requires full-text methods","Quality-specific patterns for imagined and inferred tastes overlapped in dorsal mid-insula","Neural overlap does not show subjective equivalence or auditory causation",Supports top-down taste representation,10.1016/j.pneurobio.2023.102423,36805499,peer reviewed
binaural2023,mixed evidence,"Orozco Perez et al. (2023), PLOS ONE",systematic review,"14 studies of binaural-beat stimulation and neural oscillations","Findings were inconsistent; five studies supported entrainment while others contradicted or mixed","Heterogeneous methods and small literature",Requires conservative framing,10.1371/journal.pone.0286023,37205669,peer reviewed systematic review
assr2024,established measurement mixed attention,"Griskova-Bulanova et al. (2024), Brain Sciences 14:857",systematic review,"human gamma-band ASSR studies","Attention effects on ASSR were equivocal","ASSR requires EEG or MEG; cannot be inferred from browser behavior",Defines instrumentation boundary,10.3390/brainsci14090857,39335353,peer reviewed systematic review
